honored to meet james watson codiscoverer of the structure of dna in 1953 with francis crick and rosalind franklin he was awarded the nobel prize in physiology or medicine in 1962 with crick and maurice watkins  jameswatson dna nobelprize,
the world is calling out for great leaders join me for my brandnew course the soul of leadership on exclusive discount use promo code jiyoleadership for $2499 through 331 regularly $19999
time to wake up
congratulations to my friends at the resilience music alliance on the launch of the resilience conversations a series of insightful discussions about the spirit of resilience honored to be featured in the first episode
looking forward to discussing alzheimers disease and my new book the healing self with at a4m
dont unplug plug in is here next week
the key to extraordinary wellbeing by and via thehealingself
ff inspired by
if you have time ability or desire try out this restorative meditation
deepak chopra  you are the universe  tonight at 8  woub digital
deepak restore  a deep dive into pain and inflammation part 1  youtube
deepak restore a deep dive into pain and inflammation part 2  youtube
yoga & meditation with deepak chopra & eddie stern  youtube
the singularity of science is the inseparability of space time energy information and matter it is the singularity of non sentiencethe singularity of spirituality is the inseparability of sentience in pure consciousness god
science is an activity in consciousness  theories are conceived in consciousness  experiments are designed in consciousness  observations ars made in consciousness  the biological organism is experienced in consciousness  apostles of scientism are a disservice to science
the objective reality is a mental construct for an inter subjective human experience in consciousness
you are a divine being
you are a divine being god
meditation on fundamental reality  solution to the hard problem of consciousness
the kindest thing you can do for yourself is to nurture your personal growth
thank you for this clarity
cosmic consciousness  an explanation of deep reality cosmicconsciousness god atheism theism religion philosophy
cosmic consciousness  an explanation of deep reality
what is cosmic consciousness  a short explanation of deep reality
cosmic consciousness  a short explanation of deep reality
there is a new revolution occurring in health today that revolution is you join me in austin tx on march 31st for a discussion on the future of wellbeing for more information and tickets longcenter thehealingself
its time for science to accept consciousness by via
proposition the more we evolve the less we need god a debate between for the motion vs against the motion on tuesday march 27th in nyc cast your predebate vote iq2uslive
meditation on fundamental reality solution to the hard problem of consciousnes  youtube
alan steinfeld in a conversation with deepak chopra md the healing self  youtube
cosmic consciousness an explanation of deep reality  deepak chopra md  youtube
what role do morals & ethics play in our spiritual evolution via debater
the god debate  war of the world views  join us today at 7 pm et
the god debate  please join us today 7 pm nyt
tonight were hosting a debate on the role of religion in modern life vote now on the motion the more we evolve the less we need god iq2uslive
can science and religion save each other
looking forward to tonights debate the more we evolve the less we need god with my colleagues and join the conversation from 700 pm est  845 pm est iq2uslive
the god debate live at 7pm et
we lost the debate
and i lost to and
what is consciousness and awareness is the brain the source of our consciousness or awareness what is the difference between our brain and our mind
live debate  the more we evolve the less we need god  youtube
congratulations to and
who needs facebook or other platforms for meaningful discussion debating
have you seen the online results right now 97 have voted on the same view as you guys thank you deepak and for your brilliant presentations of course the other team could not get it  not yet lets hope soon
this is interesting dont know what to make of it  thanks for the update aurora
do check on line voting results which are 97 in disagreement with you in any case it was fun  thanks xoxo
intelligence or mind whether biological or artificial is not the same as consciousness  the mind of a baby or kindergarten child is not the same as that of a phd in neuroscience  however it is the same consciousness
what is it that knows there is a brain  the brain is a symbolic representation of mind  mind brain body universe are known in consciousness consciousness is just the capacity to know & experience in all living beings a paramecium does not have a brain
consciousness is not the same as mind
argues we can improve humanity in other ways besides god we dont need god responds that we need god of consciousness to have a thought  and to understand science iq2uslive
theres no such thing as good luck via
the possibility of a science of consciousness cant begin until the obstacles in its path are removed its time for science to accept consciousness
join the conversation tonight at 700 pm est as and i discuss the healing self and elastic mind thehealingself elasticmind nyc therubinbrainwave
were so excited to have as a speaker at our unitetocure event this april mr chopra founder of the chopra foundation  is a worldrenowned pioneer in integrative medicine to read more about mr chopra visit
with my friend and colleague enjoyed our conversation about the healing self and elastic mind this evening thehealingself elasticmind
finally and i agree on almost everything here
the evidence is fully consistent with both our perspectives that a change in the brain an incomplete representation of mind correlates with a change in mental experience is expected yet what is the brain we are talking ontology which the evidence doesnt address
the god debate  war of the world views  deepak chopra md & anoop kumar md  youtube
i am that  i am
inseparability of existence
the most amazing thing in the universe is our own existence in it haveperspective  astronomers cant explain why this new galaxy has hardly any dark matter via
in the wake of the nationalschoolwalkout shares her familys conversation about gun violence student protests and hope for a more compassionate future
our notions of reality are based on the limitations of our perception & knowing   god is what mind becomes when it crosses the scale of our comprehension  freeman dyson
i do not make any clear distinction between mind and god god is what mind becomes when it has passed beyond the scale of our comprehension  freeman dyson
you are the universe discovering your cosmic self and why it matters deepak chopra md menas c kafatos phd
reality is nondual  deepak chopra md  youtube
how to let go flow & wake up from the dream called everyday reality while enjoying it  youtube
elastic mind and the healing self
the healing self  how to reinvent your body  youtube
how the human mind created the physical universe & why your true nature is neither body nor mind  youtube
great job here
do you agree with with  watch our latest debate the more we evolve the less we need god now
enjoyed the how luck happens conversation today with authors and
& in conversation the healing self meets the elastic mind nyc
absolute reality is cosmic consciousness
some clarifications about the primacy of consciousness would appreciate your comments so we can continue to learn from each other
love this comment
do read i would love to connect over lunch in nyc  please dm me
please read and share its time for science to accept consciousness by
happy easter dear friends  the symbolic language of the crucifixion is the death of the old paradigm resurrection is a leap into a whole new way of thinking
god is not a dead white male or imagined deity in the wisdom traditions of the east and those engaged in contemplative practices god is the immeasurable potential as infinite consciousness for the knowing & experience in every sentient beingwe need consciousness to do science
xoxoxo
yes id say its a good framework if consciousness is nonlocal then mind is localizing and brain is localized the caveat is that brainmind r not complementary though we often use it as such confuses materialists mind is much more vast and brain is a subset
yes mind is localized but also collectiveas in the internet minds are entangled and species specific embodied & relationalhuman minds create models  mathematics science philosophy religion technology systems of thought their source like all minds is consciousness
xoxo
fundamental reality is consciousness having an experience as sensations perceptions images  feelings & thoughts  modified activities of consciousness  mind brain body universe & god as imagined deity are human constructs
if by god means an imagined deity she is correct  if god is pure consciousness  then infinite possibilities remain as we evolve in consciousness  evolution now is meta biological it is the evolution of consciousness and of the consciousness of consciousness
brain development is a result of experience in consciousness  the brain is created by genes and sculpted by experience  relationships and social interactions in the entangled mind
god is pure consciousness in eastern contemplative traditions its our daily practice in meditation to go beyond subject object split the brain is known to consciousness alone all  evidence  requires consciousness even the search for evidence is in consciousness
the tricky business of measuring consciousness  wired
humans are a fragmented mind only by going beyond subject object split can we know cosmic mind as truth it is love not as a sentiment but as unity consciousness
famous physicians can change the world for better or worse  md magazine
7 laws for becoming a creator of reality
is wholeness the secret of wellbeing  sfgate
today is worldautismawarenessday take a look on the genomind blog as dr jay lombard  explains the genetic causes of the disorder
please read and share these are the tools that helped me overcome my ptsd via returntolife ptsd anxiety breath gratitude yoga
the healing self  2018 writers symposium by the sea via thehealingself
famous physicians can change the world for better or worse ft  by via
waking up to reality  7 axioms
deepak chopra what is nirvana
we all know that our political world is broken every major issue begging for serious conversation and the notion that one person could fix this was hopeful but truly illogical thinking we have to do this together we can fix this wecanfixthis
waking up to reality 7 steps  deepak chopra md  youtube
deepak chopra  the secret of healing  meditations for transformation and higher consciousness  youtube
the healing self trailer  youtube
know that by which all is known  youtube
you are the universe discovering your cosmic self and why it matters deepak chopra md menas c kafatos
is wholeness the secret of wellbeing by and paul j mills phd
by giving names to colors & sensations arising in consciousness through self interaction & interpreting them as forms humans create the notion of objects in a physical world in reality there is only consciousness knowing itself as sensations images feelings & thoughts
in every moment the world is a reflection of the conditioned mind
just as water remains water appearing as raindrop rainbow cloud glacier river ocean and puddle consciousness remains consciousness appearing as manifold and diverse world appearances in every sentient being
deepak explains the 11 laws of reality in the next episode of our lectures and conversations video series
the source of every experience every perspective every opinion  every perception is consciousness
yes
consciousness is without cause impersonal irreducible the source of all perceptions all volition in all living species
hope is a sign of despair being is independent of hope & despair in moments of silence there is spontaneous creativity
death happens to the experience that we call body mind  consciousness is non local and not subject to birth or death that which we call a person is a transient process in consciousness
when all notions of reality are dropped reality reveals itself  thought creates subjectobject split overshadowing the reality of the one mind love is not a sentiment but ultimate truth as unity consciousness
first there was the word and the word was made into flesh  words create relative truth  absolute truth is silence  gods language is silence everything else is poor translation  rumi
tell me about un standard chicanery id like to try it
all names & forms are transient patterns of timeless formless being  the true self
when terrorism racism bigotry prejudice hatred trade wars climate change extinction of species mechanized death gun violence extreme nationalism ethnocentrism & gangster global leaders become the norm we must address our collective insanity urgently or face extinction
the necessity for god is the fact that we cant do anything without experience all the experience is in the mind and the mind is an activity in consciousness what we call matter is the interpretation of an experience on consciousness
so the question is what might that fickleness suggest about what we truly are beyond the mask of changing identities
great explanation anoop
deepak chopra  1440 multiversity join us
prefers to attack from afar  maybe fearful of engaging in direct dialog  i would ignore him and wish him well  his career and identity seem to built on being a one man committee for the suppression of curiosity and advancement in science
its ok david  i wish you well
do listen to this rap on consciousness by  great job  also remember the hard problem exists science cannot yet explain mental or perceptual experience including the experience of doing science or the experience of creating this fun song
reflecting on dr kings speech sees humanity moving in the direction of a peaceful and just world mountaintopmoments
the god debate  war of the world views
neuroscientist on the perception  hallucination distinction
the brain is a symbolic representation of the conditioned mind  consciousness is witness to both mind and its constructs  mind brain and universe are a unified experience in consciousness
consciousness is that which is aware of all experience consciousness cannot be explored objectively because it is doing the exploring  self awareness is the only way to know it  being aware of being aware
how does a 3 pound piece of meat create concepts  imagination  intuition insight  creativity  choice intention  introspection  debate  perspective  disagreement  agreement  respect  envy  desire to know & do neuroscience  the brain cannot even feel its own pain
electro chemicals and brain are human constructs for modes of knowing in consciousness  models created by mind
chemistry and physics are systems of inquiry  created by human thought  an activity in consciousness
yes  useful practical constructs created in consciousness  the fundamental reality for all modes of knowing and experience
ok be happy
reflecting on dr kings inspiring speech today i believe humanity is moving in the direction of a peaceful and just world mountaintopmoments mlk50 mlkjr
consciousness is spontaneously creative  the conditioned mind usually overshadows it
why you should stop telling people youre so busy coauthored with via
my pleasure judith
mountaintop moments  on dr king and world peace via  mountaintopmoments worldpeace mlk
in being are infinite possibilities
part of being human is that happiness is difficult is wholeness the secret of wellbeing
deepak chopra with alan steinfeld on the healing self via
exploring consciousness with
the nature of consciousness
happy reunion with seymour reichlin md phd my professor in endocrinology who trained me is now 94 and my dear friend
what is consciousness ft and via
la meditacin  puede ser una herramienta al100 para hacer frente a los males crnicos relacionados con el estrs sugiere
origins of life and consciousness with
deepak chopra and cassandra vieten  youtube the universe is a human construct
an interview with emily adlam spooky action at across time temporal non locality  great interview by
a meditation with sophia the robot from hanson robotics  youtube
origins of life and consciousness  a conversation with bruce damer ww damer  youtube
when people think about growing old they blame the passage of time how you age happens now
freedom is knowing you are not a person  deepak chopra md  youtube
what is consciousness  the rabbit hole with deepak chopra  youtube
who is god  the rabbit hole with deepak chopra  youtube
are we living in a dream  the rabbit hole with deepak chopra  youtube
by giving names to appearances in consciousness we created the notion of objects by breaking down the perceived objects into fundamental building blocks we created the notion of elementary particles that are mathematical abstractionsthe universe is a notion in consciousness
everyday reality is a notion
all self inflicted suffering and the suffering we inflict on so called others is a result of the notion of the separate self
joy is the spontaneous expression of being
being is timelesssat chit anandatruth awareness bliss
observer & observed seer & scenery knower & known co arise in consciousness as a result of self interaction in every moment of perceptual experience the experience is in time the self is timeless
the time is always now
a must read the emergence of the eternal feminine by via
there is no such thing as a fixed universe  a theater of space & time  in which we are born & die each sentient being  is a unique lens for infinite being or non local self to dream a unique reality into existence  being is the only invariant in every passing dream yatu
via you are the universe
being is the only invariant in every passing dream robots as they evolve will augment the vivid and lucid dream we call life
the universe is a changing evanescent transforming evolving dream in non local being body and mind are part of the dream  birth & death are the beginning & end of qualia programs in a cosmic dream  waking up to self is crucial if we want to upgrade the dream
non local infinite being dreams up infinite fictional characters that dance frolic  lovefight suffer live & die in infinite dreamscapes waking up to reality allows you to choose to be the directer choreographer the hero the villain or any character in any dreamscape
deepak chopra  sleep meditation  youtube
science is humanitys greatest  most exciting  most dangerous  most promising adventure  why it needs spirituality to evolve
you are both dreamer and dream
recently posted conversation on between and on the mindbodyspirit dynamics of consciousness and at the new community cowork space theassemblage in new york city link
science is humanitys greatest most exciting most dangerous and most promising adventure  youtube
is the world we experience a controlled hallucination  conversation with neuroscientist
feeling sick at the tragic fate of children gassed to death in syria almost every nation in the world has gangsters & mobsters as their leadersthis is a sad commentary on our world culturewe have collectively allowed bullies to take control of our destiny& that of our children
good evening from la jolla
are you your memories where are memories stored deepak chopra md  youtube
how minds get poisoned and the cure  sfgate
you are the symphony of the cosmos
real synchronicity
friends i will be in in tacoma wa on april 12th at there is a new revolution occurring in health today that revolution is you get your tickets today thehealingself
there is a new revolution occurring in health today that revolution is you find the answers in the healing self coauthored with thehealingself
please watch 2018 writers symposium by the sea hosted by dean nelson via thehealingself
i would like to understand why killing innocent people with chemical gases is worse then than killing them and burning them alive with bombs and drones manipulated by computers we are an insane world to allow gangsters world leaders decide which form of killing is better
see this thursday at the beautiful pantages theater buy online or call our box office 2535915894
how minds get poisoned and the cure by via
las vegas  spiritual city
you are the light of the world
our worldview is an adaptation of a worldview inherited from someone else how minds get poisoned and the cure
5 easy ways to spring clean your health ft  via thehealingself
i love the look of the page for the second season of one simple idea on the new thought channel website check out my interviews with    greg stamper and more directed by
shield for your brain sleep8 hours handlemanage stress interactsocialize exercise800 steps learnnew things dietmediterraneanveg
ha ha  im an authentic fraudthanks for inviting me to this event  i promise authentic pseudoscience  cheers
you are kind  the fictional character deepak thanks the fictional character dani
all perspectives are just that  perspectives  truth is elusive
the universe we know as humans is not an objective reality its a cognitive universe  a construct an interpretation of raw perceptual activity in human consciousness
dr rudolph tanzi keynote speaker at brain awakening conference congratulations to
creator of reality
recommended reading 5 easy ways to spring clean your health ft via
2018 writers symposium by the sea hosted by dean nelson via thehealingself pls rt
everyone has things in their past that linger no matter how much we want to forget them here is how to forgive and let go
im surprised that the response to alternate views of reality  existence by most professional skeptics atheists & rationalists is not reasoned but violently emotional & liberally punctuated by name calling & expletives
i will miss you
experience in the form of sensations perceptions images feelings and thoughts is intangible evanescent transient & ungraspablewe reify experience by giving it names like space time & matter creating the notion of an objective world  everyday reality is a human construct
beyond the apparent diversity of form and phenomena and the relativity of all subject  object relationships is an underlying reality called awareness awareness differentiates as knower knowing & known awareness modifies itself as experience & as interpretation of experience
all experience happens now including the memory of the experience called then  now is the vivid lucid dream that consciousness projects as all minds  all bodies  all relationships & that which we call the universe of space time & matter
self awareness leads to the highest and best practical outcomes
the brain is the objective correlate of conditioned mind
toe is part of the dream  pain is part of the nightmare
thanks for sharing my mission to eliminate inflammation and for supporting it through the deepak restore bowl at the restore event in nyc read the article and head to to try the antiinflammatory salad
this is so wise on so many levels and im sure everyone can take note from these sentiments
join us at our brain mapping foundation gala my session on neuroscience of self awareness starts 1200 pm pst today brainmappingfoundation brainhealth brain brainmatters
rewire your head change your world ft via thehealingself
honored to meet neuroscientist eric kandel who is also the recipient of the 200 nobel prize in physiology or medicine for his research on the physiological basis of memory storage in neurons
giving my keynote on neuroscience of self awareness and higher consciousness brainmappingfoundation brainhealth brain brainmatters
do guesswho is the raging buffoon gangster mobster emotionally challenged fraud posing as a leader of of the civilized world  are we so impotent that we are going to risk our extinction for a bully who appeals to to the most base instincts of our reptilian brain help
thank you mark thornally for this image  an arresting moment in in infinite being
the biggest mystery of existence is awareness of existence
existence & awareness of existence are synonymous
what do you want today versus what you want five years from now how to separate your desires from your aspirations here is my approach
if you take things personally you will remain offended for life
all creativity requires freedom from the conditioned mind
my history with science pseudoscience scientism skeptics cynics psuedoprofound bullshit and consciousness
when you confuse yourself with your selfie you have lost your soul
you are contradicting yourself  you are an apostle if scientism like my friend
says that science examines an observer independent world that is validated by observation  anyone sense a contradiction
the reality illusion is our playground upgrade it or downgrade it it is our choice dailydeepak
how to you validate objective  observer independent  truth without an observer  if such a world exists it is unknowable
recent study suggests that how fit you think you are affects your risk of death more than how fit you actually are harvardhealth
the main course is silence
the observer & the observed are one krishnamurti
transcendence
to postulate an observer independent objective reality is not good science  it is not popper falsifiable and cannot be validated or refuted we live in a cognitive universe
as we evolve do we need god atheism
your true self as consciousness has no name  no form & is inconceivable  yet without it there would no experience of form  names or concepts
the world inside your skin and the world outside your skin is one being or one existence
science makes life comfortable  spirituality makes life meaningful
ultimate reality is neither subjective nor objective but transcendent potential
the universe lives through us and is fully alive and self aware in us
